"name"	"description"	"price"	"shopId"
"Professional Woodworker Pneumatic Brad Nailer And Air Stapler Combo Tool Kit"	"Lorem ipsum amet tempor mattis duis ad id fringilla duis sit per habitant."	"858.34"	"82"
"Dewalt Dcf610s2r Drills / Drivers , Power Tools, N/a"	"Lorem ipsum libero aptent quam nisi luctus, id nunc nascetur inceptos duis."	"812.97"	"179"
"Ultra Steel 6v Cordless Drill"	"Lorem ipsum pulvinar tristique erat etiam cubilia placerat magnis at etiam congue aliquam quis."	"839.53"	"14"
"Ad Tech Hi-temp Project Pro Mini Size Glue Gun"	"Lorem ipsum enim augue penatibus maecenas elementum, vehicula turpis eu iaculis est parturient."	"411.84"	"16"
"Dremel Ez407sa-01 Ez Drum Mandrel"	"Lorem ipsum imperdiet non erat suscipit sit hac platea scelerisque laoreet tortor ultrices."	"80.22"	"40"
"Ingersoll Rand 80 Gallon Type-30 Reciprocating Air Compressor"	"Lorem ipsum donec ultrices faucibus commodo primis congue aliquet luctus consequat nisi."	"615.72"	"9"
"Stalwart Mouse Sander Set, Blue, 28pc"	"Lorem ipsum bibendum pharetra feugiat vitae torquent fames ultricies felis elit."	"112.11"	"81"
"Eclipse 900-066n 50w Soldering Station"	"Lorem ipsum vulputate nunc tincidunt odio netus ridiculus eget cubilia."	"999.01"	"44"
"Black & Decker 3-speed Rtx Rotary Tool With Bonus Spring Clamps, Rtx-6"	"Lorem ipsum tempus convallis amet nec lobortis risus mollis interdum at."	"507.25"	"193"
"Dremel 560 Drywall Cutting Bit"	"Lorem ipsum eget donec aliquet felis vivamus dolor arcu tempus curae;?"	"59.2"	"198"
"Hitachi 1 3/8"" 23 Gauge Pin Nailer"	"Lorem ipsum fusce lacinia conubia leo, elit lorem lacinia sagittis."	"201.07"	"137"
"Titan Master Drill & Bit 204pc Set W/4fold Cs"	"Lorem ipsum fames phasellus erat, mattis congue diam praesent ac diam."	"559.95"	"23"
"Black & Decker 160 Psi Air Station Inflator"	"Lorem ipsum facilisi enim pellentesque phasellus id iaculis egestas, duis nostra mus."	"294.08"	"148"
"Alpha Fry Am13460 Rosin Core Solder And Dispenser"	"Lorem ipsum nibh adipiscing dolor fames congue pretium venenatis scelerisque?"	"152.15"	"200"
"Hitachi 83-piece Drill And Driver Bit Set"	"Lorem ipsum vestibulum eleifend turpis hac dictum quis ridiculus eros consectetur."	"495.53"	"47"
"Dremel 4200 Rotary Tool With Ez Change, 4200-6/40"	"Lorem ipsum id varius feugiat dictumst congue neque turpis eros mattis."	"38.11"	"20"
"Ad Tech Hi-temp Project Pro Mini Size Glue Gun"	"Lorem ipsum quis vestibulum fames cras mauris rutrum accumsan eleifend varius magna."	"84.08"	"81"
"Black And Decker Pivot Screwdriver, Pd400lg"	"Lorem ipsum fringilla, nulla lacus himenaeos feugiat libero venenatis nunc eros curae; proin."	"296.7"	"97"
"Hitachi 0.63 Hammer Drill 6.0 Amp"	"Lorem ipsum in velit ultrices turpis maecenas nam felis phasellus proin himenaeos!"	"503.48"	"99"
"Black & Decker 9.6v - 24v Multi Battery Charger"	"Lorem ipsum blandit vel pharetra congue hac lacus blandit dapibus etiam!"	"370.84"	"45"
"Bostitch 18v Lithium 1/2"" Drill/driver Kit, Btc400lb"	"Lorem ipsum tincidunt dignissim praesent dui dui a lacus metus sociis ad."	"486.1"	"13"
"Skil 5480-01 7-1/4-inch Skilsaw Circular Saw"	"Lorem ipsum consectetur phasellus, vitae vestibulum diam vestibulum taciti nibh mauris nascetur."	"133.92"	"104"
"Eclipse Pz2x1-15/16 Bit Pozidrive Size 2 1-15/16in Long 1/4in Hex"	"Lorem ipsum leo ad velit pretium curabitur ultrices justo pretium."	"902.46"	"28"
"Hot Glue Gun Helpers Kit-7 Pieces"	"Lorem ipsum dis tristique mattis natoque integer purus faucibus semper accumsan est natoque."	"897.87"	"115"
"Wen 5.2 Amp Electric Pole Saw"	"Lorem ipsum nostra potenti nisi, libero quisque eros vestibulum metus sed."	"371.93"	"4"
"Fry Technologies Cookson Elect Am33505 50/50 Solder Solid Wire"	"Lorem ipsum parturient aliquet porttitor interdum curae; nunc lacinia vehicula."	"703.47"	"51"
"Swisher 28 Ton 8.75 Gross Torque Log Splitter, Lsrb875281350"	"Lorem ipsum ipsum morbi sollicitudin lacus odio odio ullamcorper class conubia."	"38.08"	"116"
"Lincoln Industrial Grease Gun Cordless With Case"	"Lorem ipsum nullam hac mollis auctor nec turpis dictumst turpis morbi curae; nisl."	"241.79"	"10"
"Legacy Manufacturing Leghfz3850yw2 Flexzilla 3/8in X 50yd Yellow Air Hose With 1/4 Inch Mnpt Ends"	"Lorem ipsum laoreet vivamus nostra morbi fringilla aptent eu eleifend venenatis."	"811.2"	"11"
"Weller Welwes51 Analog Soldering Station With Power Unit, Soldering Pencil, Stand And Sponge"	"Lorem ipsum condimentum luctus egestas quisque ultricies conubia curae; suscipit dis, cubilia fames id."	"796.15"	"91"
"Wagner Heat Gun Kit, Ht1100"	"Lorem ipsum himenaeos felis nam; netus massa sed cubilia venenatis tincidunt ridiculus viverra!"	"811.75"	"151"
"Bostitch Air Regulator And Gauge, Npt, #iregulator"	"Lorem ipsum mattis justo leo pharetra vestibulum pharetra tristique turpis leo nisi vel dui."	"664.9"	"16"
"Professional Woodworker 7390 Multifunction Tool With 4 Accessories"	"Lorem ipsum phasellus primis mattis vitae a pellentesque nullam purus scelerisque elit eu nostra."	"709.78"	"197"
"Wagner Ht1000 Heat Tool"	"Lorem ipsum accumsan fames aliquam integer felis adipiscing tempor tortor eros magna condimentum ante!"	"628.27"	"153"
"Porter Cable 371k Compact Belt Sander"	"Lorem ipsum id condimentum, turpis congue inceptos fusce ullamcorper facilisi?"	"149.01"	"61"
"Aaa 300psi Air Compressor"	"Lorem ipsum blandit nec ridiculus mi suscipit nascetur convallis turpis pulvinar suspendisse."	"155.89"	"177"
"Black & Decker 17-piece Workbench Drill Bit Set, 15097"	"Lorem ipsum neque pharetra platea fames eu semper ante ullamcorper?"	"468.43"	"157"
"Bosch Power Tools 2 Amp 1/4 Sheet Palm Sander 7292-01"	"Lorem ipsum parturient feugiat lacinia montes diam dapibus vestibulum litora commodo sem justo neque."	"216.85"	"94"
"Bostitch 6 Amp Orbital Jig Saw, Bte340k"	"Lorem ipsum primis magna id molestie molestie accumsan vivamus integer dapibus sagittis felis tempor."	"489.96"	"85"
"Dremel 225-01 Flex Shaft"	"Lorem ipsum consequat convallis curae; metus aliquam sagittis placerat sagittis molestie diam."	"750.63"	"46"
"Wagner Ht1000 Heat Tool Wagner Ht1000 Heat Tool"	"Lorem ipsum rutrum leo facilisis penatibus cursus conubia torquent class sed rutrum est."	"227.82"	"126"
"Bostitch .5"" Vsr 2-speed Hammerdrill/drill, Bte140k"	"Lorem ipsum fusce volutpat tortor platea ridiculus sodales id sociis nibh aliquet penatibus eget!"	"84.32"	"146"
"Skil 10 Count U Shank Jigsaw Blade Set 94910"	"Lorem ipsum metus sociosqu quis massa augue non aliquam litora per libero."	"993.05"	"24"
"Fry Technologies Cookson Elect Am32406 General Purpose Acid Core Solder"	"Lorem ipsum volutpat eget per in libero dui tellus varius diam."	"840.74"	"147"
"High-temp Cordless Glue Gun, White"	"Lorem ipsum mattis egestas leo justo aenean aptent aptent mus arcu natoque."	"516.48"	"142"
"Irwin 7-piece Drive Set, 1885553"	"Lorem ipsum nisi primis fringilla volutpat convallis nullam scelerisque ultrices per?"	"171.95"	"134"
"Lincoln Industrial Fully Automatic Pneumatic Grease Gun"	"Lorem ipsum neque nam nullam leo adipiscing ac vel pellentesque lacus magna aliquam rhoncus?"	"393.74"	"103"
"Pentagon Tools 3/8 300psi Heavy Duty Retractable 100 Foot Air Hose & Reel Professional Grade"	"Lorem ipsum phasellus elit feugiat luctus facilisi senectus eleifend ac interdum."	"473.91"	"70"
"Skil 2364-02 7.2-volt Lithium-ion 2-speed Drill/driver"	"Lorem ipsum vestibulum platea velit felis faucibus aenean sodales euismod pulvinar ligula."	"368.05"	"137"
"Rockwell Shopseries 4.3 Amp Belt/disk Sander"	"Lorem ipsum fringilla adipiscing nec donec porttitor dis urna etiam aenean lectus."	"90.61"	"155"
"Hitachi 4 1/2"" 5 Amp Angle Grinder"	"Lorem ipsum semper sagittis maecenas suspendisse placerat quam tempus vitae inceptos."	"709.5"	"106"
"Skil 1400-02 Multi-tasker 2.0a Oscillating Tool Kit"	"Lorem ipsum at scelerisque tellus, ultricies taciti cras volutpat cum."	"899.89"	"78"
"Professional Woodworker 18 Gauge Brad Nailer With 2-gallon 100 Psi Twin Stack Compressor Combo Kit"	"Lorem ipsum volutpat commodo dis sagittis interdum dignissim donec a sociosqu."	"224.25"	"12"
"Porter Cable 1/2 18v Cordless Driver"	"Lorem ipsum lorem parturient dictumst ut et sodales velit felis id imperdiet?"	"87.95"	"87"
"Ad Tech Hi-temp Mini Size Glue Gun"	"Lorem ipsum nunc pellentesque a diam eget porta, interdum eget."	"232.31"	"17"
"Bostitch Prozhoze, 3/8"" X 50, Hopb3850"	"Lorem ipsum natoque at magna metus euismod consequat dignissim semper convallis."	"866.14"	"64"
"Trinity Stainless Steel Table"	"Lorem ipsum posuere aenean in nullam consectetur augue iaculis, aptent enim scelerisque eu."	"189.93"	"189"
"Speare Tools Adjustable Speaker-cutter Hole Saw, Ab 1610"	"Lorem ipsum ultricies aenean lobortis est facilisis congue mollis netus cras volutpat integer."	"360.9"	"124"
"Fry Technologies Cookson Elect Am53945 Flo-temp Lead-free Solid Wire Solder"	"Lorem ipsum tristique proin est vitae id enim fringilla class nullam velit ultricies magna."	"500.38"	"112"
"Ad Tech Multi-temp Full Size 4"" Glue Sticks, 50 Ct"	"Lorem ipsum risus egestas curae; porta duis donec praesent nunc quis mauris erat?"	"416.8"	"38"
"Black And Decker 20v Max Lithium Drill And Circular Saw Kit, Bdcd220rs"	"Lorem ipsum per integer himenaeos; cum placerat proin pharetra aliquet lacinia tristique sed commodo."	"456.67"	"182"
"Bostitch Prozhoze, 3/8"" X 100, Hopb38100"	"Lorem ipsum non, conubia mi sociis blandit libero convallis nulla!"	"592.25"	"9"
"Dremel Minimite Rotary Tool W/bonus Tools Set & Bag"	"Lorem ipsum non massa inceptos mi porttitor cursus auctor eleifend eros rhoncus."	"190.2"	"64"
"Ingersoll Rand Hammer Pin"	"Lorem ipsum dapibus egestas luctus a morbi congue semper pellentesque proin semper et tortor!"	"199.21"	"68"
"Black & Decker 17-piece Workbench Drill Bit Set, 15097"	"Lorem ipsum vivamus taciti gravida mus arcu sem praesent non id donec."	"961.26"	"180"
"Pentagon Tools 3/8 300psi Heavy Duty Retractable 100 Foot Air Hose & Reel Professional Grade"	"Lorem ipsum vulputate convallis a feugiat proin nam tempus scelerisque vivamus."	"840.42"	"51"
"Fry Technologies Cookson Elect Am53945 Flo-temp Lead-free Solid Wire Solder"	"Lorem ipsum torquent sociis netus magna sed quam tortor porttitor."	"120.61"	"64"
"Bostitch Prozhoze, 1/4"" X 100, Hopb14100"	"Lorem ipsum ut ultricies platea suscipit commodo ultricies eros libero."	"531.59"	"180"
"Drill America Cone Carbide Burr 1/4 Shank"	"Lorem ipsum consectetur dictumst sagittis varius dictum sed sociis scelerisque?"	"595.59"	"96"
"Striker Adjustable Garage Parking Sensor"	"Lorem ipsum phasellus dignissim rhoncus neque dictumst rutrum malesuada nullam elementum."	"161.13"	"108"
"Dremel Two Speed Rotary Tool Kit With 15 Accessories 200-1-15"	"Lorem ipsum convallis vel habitasse vestibulum dui curae; cursus phasellus nostra."	"810.04"	"65"
"Metabo W8-115qwc Compact Class Professional Series Angle Grinder, 4 1/2"" Wheel"	"Lorem ipsum blandit aptent ligula urna molestie praesent orci vestibulum."	"735.99"	"13"
"Irwin 7-piece Drive Set, 1885553"	"Lorem ipsum senectus semper volutpat suscipit nibh pellentesque, facilisis elit?"	"534.17"	"159"
"Worx Semi Automatic Sd Driver, Wx254l"	"Lorem ipsum leo gravida iaculis cum senectus inceptos, aliquam a ornare."	"590.09"	"121"
"Primefit 25-piece Air Compressor Accessory Kit"	"Lorem ipsum sodales feugiat rhoncus faucibus commodo quam venenatis cum nisl."	"278.5"	"24"
"Bostitch .5"" Vsr 2-speed Hammerdrill/drill, Bte140k"	"Lorem ipsum lacinia arcu iaculis nisi volutpat duis nullam inceptos taciti ipsum."	"490.34"	"50"
"Wagan Hi Speed Air Compressor"	"Lorem ipsum vestibulum quis quis nibh congue turpis sagittis mattis viverra non eleifend."	"495.88"	"19"
"Legacy Mfg Straight-on Tapered Chuck Inflator W/ 12 In. Hose, Brass Indicator Bar, 10-90 Psi"	"Lorem ipsum facilisi auctor nunc cum a phasellus potenti lacinia ligula curabitur?"	"365.37"	"70"
"Ingersoll Rand 1/2 Titanium Imp Wr W/2 Ext"	"Lorem ipsum posuere platea sociosqu augue, aenean luctus feugiat auctor vivamus."	"35.63"	"145"
"Professional Woodworker Pneumatic Brad Nailer And Air Stapler Combo Tool Kit"	"Lorem ipsum dolor aliquet accumsan ultrices sodales egestas eleifend cursus."	"203.48"	"123"
"Wagner Ht3500 Heat Gun"	"Lorem ipsum magnis, vivamus parturient parturient urna ipsum pulvinar blandit lectus metus lorem."	"6.26"	"124"
"Black & Decker Matrix Sanding Head Attachment, Bdcmts"	"Lorem ipsum consectetur lobortis cum aliquam consectetur ligula vehicula elit."	"518.58"	"49"
"Skil 360 Quick-select 4v Max 1.5ah Lithium-ion Screwdriver, 2356-01"	"Lorem ipsum habitant lacinia malesuada egestas tempus cum litora condimentum rhoncus lobortis vitae ipsum?"	"446.28"	"131"
"Porter Cable 352vs 3"" X 21"" Variable Speed Belt Sander"	"Lorem ipsum aenean eget per maecenas primis adipiscing luctus eleifend cum!"	"667.13"	"107"
"Fein Asb 14 + Afmm 14 14.4v, 4ah, Cordless Fmm + Hammer Drill"	"Lorem ipsum facilisi congue mus odio feugiat at id tincidunt faucibus mollis."	"976.69"	"63"
"Black & Decker 109-piece Basic Project Set, 71-0109"	"Lorem ipsum scelerisque cubilia libero metus suspendisse sed ridiculus condimentum euismod ad."	"213.59"	"31"
"Fry Technologies Cookson Elect Am32406 General Purpose Acid Core Solder"	"Lorem ipsum lacus nisl sollicitudin habitant montes enim quis fermentum velit egestas?"	"915.01"	"110"
"Kawasaki Composite Air Hammer Kit"	"Lorem ipsum habitasse suscipit risus nec tempus mus hac urna nunc morbi."	"488.67"	"193"
"Dremel Sm520 3"" Masonry Cut-off Wheel"	"Lorem ipsum lacinia commodo penatibus elit dis class venenatis odio dapibus dapibus condimentum sollicitudin."	"167"	"110"
"Hitachi 18-volt Lithium-ion Cordless Impact Driver, Hxp"	"Lorem ipsum nostra sed ad a orci leo consectetur ultrices faucibus dapibus nam nunc."	"461.85"	"111"
"Skil 74102 10in 200 Tooth Steel Circular Saw Blade"	"Lorem ipsum porttitor risus ad inceptos lobortis vivamus dignissim elementum, cum urna."	"580.85"	"158"
"Black & Decker 109-piece Basic Project Set, 71-0109"	"Lorem ipsum aliquam dis accumsan velit odio est sollicitudin enim laoreet."	"58.67"	"179"
"Stanley Fatmax 20-volt Lithium Cordless Hammer Drill, Fmc620la"	"Lorem ipsum sollicitudin potenti curabitur aliquam vel ante aliquam tristique magnis velit suscipit in."	"347.81"	"167"
"Skil 10 Count U Shank Jigsaw Blade Set 94910"	"Lorem ipsum arcu vel semper risus conubia venenatis diam interdum accumsan."	"93.13"	"104"
"Black & Decker 5.2 Amp 3/8"" Drill And Driver With Storage Bag, Dr260bozr"	"Lorem ipsum massa odio cubilia cum facilisi netus consequat augue venenatis adipiscing platea."	"463.85"	"196"
"Ingersoll Rand 705-93 Trigger"	"Lorem ipsum semper conubia eros cubilia blandit sociosqu montes conubia blandit felis ultrices aliquet."	"57.03"	"43"
"Dremel 225-01 Flex Shaft"	"Lorem ipsum diam integer mattis integer urna quam pretium turpis."	"229.1"	"69"
"Surebonder Ultra-mini Dual Temperature Glue Gun"	"Lorem ipsum feugiat habitant justo, amet egestas bibendum nam phasellus pellentesque dui ipsum sociosqu."	"110.5"	"186"
"Black & Decker 20v Smart Select Cordless Drill"	"Lorem ipsum nisl iaculis potenti leo cras primis sociis lacus aptent."	"254.69"	"68"
"Hitachi 18v Lithium-ion Cordless Impact Driver"	"Lorem ipsum molestie fringilla nascetur ipsum montes varius vitae fringilla."	"751.66"	"146"
